<?xml version="1.0" encoding="utf-8"?>
<database xmlns:xsi="http://www.w3.org/2001/XMLSchema-instance" xsi:noNamespaceSchemaLocation="database.xsd">
    <type>HSQLDB</type>
    <driverClass>org.hsqldb.jdbc.JDBCDriver</driverClass>
    <url>jdbc:hsqldb:mem:benchbase;sql.syntax_mys=true</url>
    <username>admin</username>
    <password>password</password>
    <transactionIsolation>TRANSACTION_SERIALIZABLE</transactionIsolation>
    <batchSize>128</batchSize>
    <retries>3</retries>
</database>